{
  "$schema": "https://json-schema.org/draft/2020-12/schema",
  "type": "object",
  "properties": {
    "id": {
      "type": "string"
    },
    "category": {
      "type": "string"
    },
    "keywords": {
      "type": "array",
      "items": {
        "type": "string"
      }
    },
    "question": {
      "type": "string"
    },
    "answer": {
      "type": "string"
    },
    "$schema": {
      "type": "string"
    }
  },
  "required": [
    "id",
    "category",
    "keywords",
    "question",
    "answer"
  ]
}