{
  "id": "faq-fasilitas",
  "category": "Fasilitas",
  "keywords": ["fasilitas", "lab", "laboratorium", "perpustakaan", "gor", "lapangan", "komputer", "wifi", "ruang kelas"],
  "question": "Apa saja fasilitas unggulan pendukung pembelajaran di SMAN 1 Klaten?",
  "answer": "Fasilitas di SMAN 1 Klaten meliputi: Laboratorium Fisika, Kimia, dan Biologi berstandar riset; 3 Laboratorium Komputer berkecepatan tinggi; Perpustakaan Digital Graha Pustaka dengan ribuan e-book; Gelanggang Olahraga (GOR) indoor untuk basket dan bulu tangkis; Lapangan upacara & sepak bola; Ruang Audio Visual; Masjid Kampus; serta Wi-Fi fiber optic terdistribusi di setiap ruang kelas ber-AC."
}
