{
  "id": "faq-berita",
  "category": "Berita dan Pengumuman",
  "keywords": ["berita", "pengumuman", "kabar", "agenda", "informasi", "terbaru", "kegiatan", "prestasi", "osn", "futsal", "jadwal", "ujian", "upacara", "ppdb", "workshop", "dies natalis"],
  "question": "Di mana membaca berita dan pengumuman terbaru SMA Negeri 1 Klaten?",
  "answer": "Berita, pengumuman, dan informasi kegiatan sekolah tersedia di halaman Berita. Konten antara lain jadwal PPDB 2026, hasil OSN, pendaftaran 23 ekstrakurikuler, jadwal ujian, dies natalis, dan kegiatan alumni KAPASSKA."
}
