{
  "id": "faq-ppdb",
  "category": "PPDB",
  "keywords": ["ppdb", "daftar", "jalur", "zonasi", "prestasi", "afirmasi", "mutasi", "syarat", "nilai", "jadwal"],
  "question": "Bagaimana jalur seleksi dan syarat PPDB di SMA Negeri 1 Klaten?",
  "answer": "PPDB SMAN 1 Klaten mengikuti regulasi Dinas Pendidikan Jawa Tengah dengan 4 jalur resmi: 1) Jalur Zonasi (minimal 55%), 2) Jalur Afirmasi bagi keluarga ekonomi tidak mampu (minimal 20%), 3) Jalur Prestasi akademik/non-akademik (maksimal 20%), dan 4) Jalur Perpindahan Tugas Orang Tua (maksimal 5%). Berkas wajib: Ijazah/SKL SMP, Kartu Keluarga minimal 1 tahun, Akta Kelahiran, dan piagam kejuaraan berjenjang jika melalui jalur prestasi."
}
