{
  "id": "faq-direktori",
  "category": "Direktori Sekolah",
  "keywords": ["direktori", "guru", "pimpinan", "wakil kepala sekolah", "wakasek", "kepala sekolah", "staff", "tenaga kependidikan", "kurikulum", "kesiswaan", "sarana prasarana", "humas", "komite"],
  "question": "Siapa saja pimpinan dan guru SMA Negeri 1 Klaten?",
  "answer": "Kepala Sekolah: Tantri Ambarsari, S.Pd., M.Eng. Wakasek Kurikulum: FX. Febriyanto Adi Nugroho, S.Si. Wakasek Kesiswaan: Bambang Budianto, S.Pd. Wakasek Sarana dan Prasarana: Agus Purnama, S.Pd. Wakasek Hubungan Masyarakat: Resmiyati, S.Pd., M.Pd. Ketua Komite Sekolah: Drs. Sumargana, M.S. Daftar lengkap guru per bidang studi tersedia di halaman Direktori."
}
