{
  "id": "faq-profil",
  "category": "Profil Sekolah",
  "keywords": ["profil", "sejarah", "npsn", "akreditasi", "alamat", "lokasi", "kepala sekolah", "tantri ambarsari", "visi", "misi", "telepon"],
  "question": "Apa visi, misi, kepala sekolah, dan identitas resmi SMA Negeri 1 Klaten?",
  "answer": "SMA Negeri 1 Klaten (SMANSA) didirikan pada 5 November 1957 dan beralamat di Jl. Merbabu No. 13, Klaten Selatan, Jawa Tengah (Kode Pos 57423, Telp 0272-321150). NPSN Resmi: 20309676 dengan Akreditasi A (Unggul). Kepala Sekolah saat ini adalah Ibu Tantri Ambarsari, S.Pd., M.Eng. Slogan sekolah: 'SMA Negeri 1 Klaten Berkarakter Hebat Jaya'. Visi: 'Terwujudnya lulusan yang religius, cerdas, berkarakter, berbudi pekerti luhur, berdaya saing global dan beretika lingkungan'."
}
