{
  "id": "faq-prestasi",
  "category": "Prestasi & Alumni",
  "keywords": ["prestasi", "osn", "olimpiade", "juara", "alumni", "ptn", "ugm", "itb", "ui", "kelulusan"],
  "question": "Bagaimana rekam jejak prestasi akademik dan sebaran alumni SMAN 1 Klaten?",
  "answer": "SMAN 1 Klaten secara konsisten meraih medali emas dan perak pada Olimpiade Sains Nasional (OSN) bidang Matematika, Fisika, Astronomi, dan Kebumian, serta Festival Lomba Seni Siswa Nasional (FLS2N). Lebih dari 90% lulusan setiap tahunnya diterima di Perguruan Tinggi Negeri terkemuka seperti UGM, ITB, UI, UNDIP, UNS, UNAIR, dan ITS baik melalui jalur SNBP, SNBT, maupun IUP Internasional."
}
