{
  "id": "faq-ekskul",
  "category": "Ekstrakurikuler",
  "keywords": ["ekskul", "ekstrakurikuler", "kegiatan", "organisasi", "osmansa", "mpk", "dewan ambalan", "prata", "emapala", "romansa", "persik", "perkasa", "sakla music", "sakla voice", "juju", "kir", "futsal", "eagles", "recsa", "ec", "sparkle", "tsl", "secure", "daco", "icomsa", "snapshot", "hadroh"],
  "question": "Apa saja 23 kegiatan ekstrakurikuler dan organisasi siswa resmi di SMAN 1 Klaten?",
  "answer": "SMAN 1 Klaten membina 23 ekstrakurikuler resmi: 1) Kepemimpinan: OSMANSA (OSIS), MPK, Dewan Ambalan (Pramuka), PRATA (Paskibra). 2) Pecinta Alam & Sosial: EMAPAL, RECSA (PMR). 3) Kerohanian: ROMANSA (Rohis), PERSIK (Rohkris), PERKASA (Rohkat). 4) Kesenian: Sakla Music, Sakla Voice, Sparkle (Dance), TSL (Teater Sapu Lidi), DACO (Seni Rupa), Al-Zamartanabil (Hadroh). 5) Sains, Literasi & Teknologi: KIR (Karya Ilmiah Remaja), JUJU (Jurnalistik), EC (English Club), SECURE (IT & Riset), Icomsa (Robotik), SNAPSHOT (Fotografi/Videografi). 6) Olahraga: Futsal Padmawijaya, Smansa Eagles (Basket)."
}
